### ISSUE TITLE
Raspberry pi 3 picoGW packet forwader and thethingnetwork

### ISSUE THREAD

**Issue by mazareth** [Lora-net/picoGW_packet_forwarder#2]
Hi,

On windows, using the PicoGW UI, to drive my gateway picocell_gateway, i've done the entire scheme from the lora sensor, by the gateway, to server.

But when i tried to do the same on raspberry pi I've a problem, my the thing network doesn't receive any message.
![image](https://user-images.githubusercontent.com/19725586/32882242-02e27858-cab4-11e7-9ac7-02e1df9f058f.png)

when i'm on localhost that's work 
![image](https://user-images.githubusercontent.com/19725586/32883033-7c837d04-cab6-11e7-979c-c90b89d31f71.png)

Do you have any solution?

**Comment by mcoracin** [comment]
Hi,

You need to configure the packet forwarder to use port 1700 for the things network, instead of 1680.

**Comment by mazareth** [comment]
Thanks for the reply mcoracin, but i've already try to change my port.
How can i found where the error come from?
Maybe it's because i use ssh to drive my raspberry?
![image](https://user-images.githubusercontent.com/19725586/32886706-d4696cc6-cac1-11e7-866e-69532152467e.png)

[global_conf.zip](https://github.com/Lora-net/picoGW_packet_forwarder/files/1478209/global_conf.zip)

**Comment by mcoracin** [comment]
Is the internet connection of your raspberry pi working?
(ping www.google.com)

Then you can check what is happening on the network link between the RPi et thethingsnetwork using tcpdump.

`sudo tcpdump -i eth0 'udp port 1700' -X`

should show something like:

```
14:39:24.147476 IP lora-iot-sk.local.40206 > 52.169.76.203.1700: UDP, length 215
	0x0000:  4500 00f3 395e 4000 4011 9883 0a90 dc14  E...9^@.@.......
	0x0010:  34a9 4ccb 9d0e 06a4 00df 6909 02a9 8e00  4.L.......i.....
	0x0020:  b827 ebff fe77 76c0 7b22 7278 706b 223a  .'...wv.{"rxpk":
	0x0030:  5b7b 2274 6d73 7422 3a31 3230 3139 3332  [{"tmst":1201932
	0x0040:  3035 322c 2263 6861 6e22 3a34 2c22 7266  052,"chan":4,"rf
	0x0050:  6368 223a 302c 2266 7265 7122 3a38 3637  ch":0,"freq":867
	0x0060:  2e33 3030 3030 302c 2273 7461 7422 3a31  .300000,"stat":1
	0x0070:  2c22 6d6f 6475 223a 224c 4f52 4122 2c22  ,"modu":"LORA","
	0x0080:  6461 7472 223a 2253 4631 3242 5731 3235  datr":"SF12BW125
	0x0090:  222c 2263 6f64 7222 3a22 342f 3522 2c22  ","codr":"4/5","
	0x00a0:  6c73 6e72 223a 392e 352c 2272 7373 6922  lsnr":9.5,"rssi"
	0x00b0:  3a2d 3137 2c22 7369 7a65 223a 3239 2c22  :-17,"size":29,"
	0x00c0:  6461 7461 223a 2251 4263 6341 5361 4144  data":"QBccASaAD
	0x00d0:  4141 432f 6838 7044 6f32 6232 3658 332f  AAC/h8pDo2b26X3/
	0x00e0:  695a 336b 734e 6d49 6f43 3070 6338 3d22  iZ3ksNmIoC0pc8="
	0x00f0:  7d5d 7d                                  }]}
14:39:24.176678 IP 52.169.76.203.1700 > lora-iot-sk.local.40206: UDP, length 4
	0x0000:  4500 0020 72a8 4000 fa11 a60b 34a9 4ccb  E...r.@.....4.L.
	0x0010:  0a90 dc14 06a4 9d0e 000c 6360 02a9 8e01  ..........c`....
	0x0020:  0000 0000 0000 0000 0000 0000 0000       ..............
14:39:26.039569 IP lora-iot-sk.local.58689 > 52.169.76.203.1700: UDP, length 12
	0x0000:  4500 0028 39f4 4000 4011 98b8 0a90 dc14  E..(9.@.@.......
	0x0010:  34a9 4ccb e541 06a4 0014 683e 025f 5f02  4.L..A....h>.__.
	0x0020:  b827 ebff fe77 76c0                      .'...wv.
14:39:26.068455 IP 52.169.76.203.1700 > lora-iot-sk.local.58689: UDP, length 4
	0x0000:  4500 0020 7474 4000 fa11 a43f 34a9 4ccb  E...tt@....?4.L.
	0x0010:  0a90 dc14 06a4 e541 000c 4a74 025f 5f04  .......A..Jt.__.
	0x0020:  0000 0000 0000 0000 0000 0000 0000       ..............

```

Which shows the UDP protocol between the GW and the Network Server.

**Comment by mcoracin** [comment]
There is no problem using SSH to connect to the raspberry pi to do that.

**Comment by mazareth** [comment]
Is the internet connection of your raspberry pi working?
(ping www.google.com) => OK

tcpdump not installed, after installation gateway work.

Thank you

**Comment by mcoracin** [comment]
You mean that installing tcpdump fixed you connection GW <-> thethingsnetwork issue? :)

**Comment by mazareth** [comment]
Yes thank you.

**Comment by mcoracin** [comment]
hummm, ok, I think the problem was elsewhere, but as long as it works. ;)
